{
  "schemaVersion": 1,
  "sourceArtifact": {
    "tag": "chapter3-artifact-v1.4.0",
    "evidenceAnchor": "b5fe1c8ec2153d1e84e0492012be44a45182dfe2",
    "fundTokenPath": "contracts/src/FundToken.sol",
    "navRegistryPath": "contracts/src/NAVRegistry.sol",
    "riskRegistryPath": "contracts/src/RiskRegistry.sol"
  },
  "counts": {
    "total": 42,
    "valid": 18,
    "invalid": 24
  },
  "determinism": {
    "chainId": 31337,
    "genesisTimestamp": 1710000000,
    "oneOperationPerBlock": true,
    "freshDeploymentPerScenario": true,
    "semanticDigestExcludes": [
      "transactionHash",
      "blockHash",
      "gasUsed"
    ],
    "semanticDigestIncludes": [
      "eventOrder",
      "eventArgs",
      "businessTimestamp",
      "stateProjection"
    ],
    "deploymentOrder": [
      "RiskRegistry",
      "NAVRegistry",
      "FundToken"
    ],
    "restoreDeployerNonceBeforeEachArm": true,
    "riskGatePolicy": "source-locked production RiskRegistry configured without metrics",
    "actorBinding": "fixed manifest addresses"
  },
  "predicates": [
    "Authorized",
    "ComplianceValid",
    "NAVValid",
    "LifecycleValid",
    "ParamConsistent"
  ],
  "variants": {
    "M0": "all predicates enforced",
    "M1": "Authorized removed",
    "M2": "ComplianceValid removed",
    "M3": "NAVValid removed",
    "M4": "LifecycleValid removed",
    "M5": "ParamConsistent removed"
  },
  "resultTaxonomy": [
    "expected_accept",
    "expected_reject",
    "invalid_transition_accepted",
    "rejected_by_residual_guard",
    "runtime_revert",
    "state_divergence",
    "event_divergence"
  ],
  "fixtures": {
    "bare": {
      "extends": null,
      "steps": [
        {
          "atSec": 10,
          "call": "deployRiskRegistry",
          "caller": "harness",
          "args": {
            "admin": "admin",
            "initialWeightsBps": "$initialWeightsBps",
            "maxStaleAgeSec": "$maxStaleAgeSec",
            "kappaBps": "$kappaBps"
          }
        },
        {
          "atSec": 20,
          "call": "deployNAVRegistry",
          "caller": "harness",
          "args": {
            "admin": "admin"
          }
        },
        {
          "atSec": 30,
          "call": "deployFundToken",
          "caller": "harness",
          "args": {
            "admin": "admin",
            "fundId": "$fundId",
            "navRegistry": "NAVRegistry"
          }
        },
        {
          "atSec": 40,
          "call": "setRiskGate",
          "caller": "admin",
          "args": {
            "riskGate": "RiskRegistry"
          }
        },
        {
          "atSec": 42,
          "call": "grantRole",
          "caller": "admin",
          "args": {
            "contract": "NAVRegistry",
            "role": "MANAGER_ROLE",
            "account": "manager"
          }
        },
        {
          "atSec": 44,
          "call": "grantRole",
          "caller": "admin",
          "args": {
            "contract": "FundToken",
            "role": "SUBSCRIPTION_ROLE",
            "account": "subscriptionOperator"
          }
        },
        {
          "atSec": 46,
          "call": "grantRole",
          "caller": "admin",
          "args": {
            "contract": "FundToken",
            "role": "REDEMPTION_ROLE",
            "account": "redemptionOperator"
          }
        },
        {
          "atSec": 48,
          "call": "grantRole",
          "caller": "admin",
          "args": {
            "contract": "FundToken",
            "role": "PAUSER_ROLE",
            "account": "pauser"
          }
        }
      ]
    },
    "eligible": {
      "extends": "bare",
      "steps": [
        {
          "atSec": 60,
          "call": "setWhitelisted",
          "caller": "admin",
          "args": {
            "investor": "alice",
            "eligible": true,
            "vcHash": "$aliceVcHash"
          }
        }
      ]
    },
    "initial_nav": {
      "extends": "bare",
      "steps": [
        {
          "atSec": 60,
          "call": "postInitialNAV",
          "caller": "manager",
          "args": {
            "fundId": "$fundId",
            "initialNav": "$initialNav",
            "asOfSec": 60,
            "payloadHash": "$initialNavPayloadHash"
          }
        }
      ]
    },
    "eligible_initial_nav": {
      "extends": "eligible",
      "steps": [
        {
          "atSec": 90,
          "call": "postInitialNAV",
          "caller": "manager",
          "args": {
            "fundId": "$fundId",
            "initialNav": "$initialNav",
            "asOfSec": 90,
            "payloadHash": "$initialNavPayloadHash"
          }
        }
      ]
    },
    "pending_subscription": {
      "extends": "eligible_initial_nav",
      "steps": [
        {
          "atSec": 120,
          "call": "requestSubscription",
          "caller": "alice",
          "args": {
            "subscriptionAmount": "$subscriptionAmount"
          }
        }
      ]
    },
    "pending_subscription_no_nav": {
      "extends": "eligible",
      "steps": [
        {
          "atSec": 120,
          "call": "requestSubscription",
          "caller": "alice",
          "args": {
            "subscriptionAmount": "$subscriptionAmount"
          }
        }
      ]
    },
    "tiny_pending_subscription": {
      "extends": "eligible",
      "steps": [
        {
          "atSec": 90,
          "call": "postInitialNAV",
          "caller": "manager",
          "args": {
            "fundId": "$fundId",
            "initialNav": "$highNav",
            "asOfSec": 90,
            "payloadHash": "$initialNavPayloadHash"
          }
        },
        {
          "atSec": 120,
          "call": "requestSubscription",
          "caller": "alice",
          "args": {
            "subscriptionAmount": "1"
          }
        }
      ]
    },
    "funded_alice": {
      "extends": "pending_subscription",
      "steps": [
        {
          "atSec": 150,
          "call": "acceptSubscription",
          "caller": "subscriptionOperator",
          "args": {
            "requestId": 0
          }
        }
      ]
    },
    "funded_alice_bob": {
      "extends": "funded_alice",
      "steps": [
        {
          "atSec": 180,
          "call": "setWhitelisted",
          "caller": "admin",
          "args": {
            "investor": "bob",
            "eligible": true,
            "vcHash": "$bobVcHash"
          }
        },
        {
          "atSec": 210,
          "call": "transfer",
          "caller": "alice",
          "args": {
            "to": "bob",
            "amount": "20000000000000000000"
          }
        }
      ]
    },
    "pending_redemption": {
      "extends": "funded_alice",
      "steps": [
        {
          "atSec": 180,
          "call": "requestRedemption",
          "caller": "alice",
          "args": {
            "redeemedShares": "$redemptionAmount"
          }
        }
      ]
    },
    "settled_redemption": {
      "extends": "pending_redemption",
      "steps": [
        {
          "atSec": 210,
          "call": "settleRedemption",
          "caller": "redemptionOperator",
          "args": {
            "requestId": 0
          }
        }
      ]
    },
    "queued_alice": {
      "extends": "funded_alice",
      "steps": [
        {
          "atSec": 170,
          "call": "setWhitelisted",
          "caller": "admin",
          "args": {
            "investor": "bob",
            "eligible": true,
            "vcHash": "$bobVcHash"
          }
        },
        {
          "atSec": 180,
          "call": "requestRedemption",
          "caller": "alice",
          "args": {
            "redeemedShares": "80000000000000000000"
          }
        }
      ]
    },
    "revoked_funded_alice": {
      "extends": "funded_alice",
      "steps": [
        {
          "atSec": 180,
          "call": "setWhitelisted",
          "caller": "admin",
          "args": {
            "investor": "alice",
            "eligible": false,
            "vcHash": "$aliceVcHash"
          }
        }
      ]
    },
    "revoked_pending_subscription": {
      "extends": "pending_subscription",
      "steps": [
        {
          "atSec": 150,
          "call": "setWhitelisted",
          "caller": "admin",
          "args": {
            "investor": "alice",
            "eligible": false,
            "vcHash": "$aliceVcHash"
          }
        }
      ]
    },
    "nav_history": {
      "extends": "initial_nav",
      "steps": [
        {
          "atSec": 90,
          "call": "postNAV",
          "caller": "manager",
          "args": {
            "fundId": "$fundId",
            "netAssetValue": "110000000000000000000",
            "totalSharesSnapshot": "100000000000000000000",
            "asOfSec": 80,
            "payloadHash": "$formulaNav1PayloadHash"
          }
        },
        {
          "atSec": 120,
          "call": "postNAV",
          "caller": "manager",
          "args": {
            "fundId": "$fundId",
            "netAssetValue": "120000000000000000000",
            "totalSharesSnapshot": "100000000000000000000",
            "asOfSec": 110,
            "payloadHash": "$formulaNav2PayloadHash"
          }
        }
      ]
    },
    "paused_funded": {
      "extends": "funded_alice_bob",
      "steps": [
        {
          "atSec": 240,
          "call": "pause",
          "caller": "pauser",
          "args": {}
        }
      ]
    },
    "paused_pending_subscription": {
      "extends": "pending_subscription",
      "steps": [
        {
          "atSec": 150,
          "call": "pause",
          "caller": "pauser",
          "args": {}
        }
      ]
    },
    "paused_pending_redemption": {
      "extends": "pending_redemption",
      "steps": [
        {
          "atSec": 210,
          "call": "pause",
          "caller": "pauser",
          "args": {}
        }
      ]
    },
    "allowanced_paused_funded": {